{
  "version": "cogs.stage4-campaign-evidence/v1",
  "authority": "local-static-campaign-evidence-model",
  "campaign_issue": "S4-10/#361",
  "execution_authorized": false,
  "attempt_number": 1,
  "retry_count": 0,
  "plan_sha256": "ce250512ec68bfdc3466acef1a827de8849509d83964770ebbc9e07d214965b0",
  "artifact_set_root_sha256": "697650137320b87f8595b470ea0563f198cf73933e7348ac751ece6eec5130fd",
  "events": []
}
